<?xml version="1.0" encoding="UTF-8"?>
<bms20160101:HentBemyndigelserResponse
        xmlns:bms20160101="http://nsi.dk/bemyndigelse/2016/01/01/"
        xmlns:xsi="http://www.w3.org/2001/XMLSchema-instance"
        xsi:schemaLocation="http://nsi.dk/bemyndigelse/2016/01/01 ../../../main/resources/schema/2016_01_01/bemyndigelsesservice.xsd">
    <Bemyndigelse>
        <BemyndigelseKode>9DD1BC7E-76AF-43BC-9C2C-ABAE4257E64F</BemyndigelseKode>
        <BemyndigendeCpr>2005511871</BemyndigendeCpr>
        <BemyndigedeCpr>0304838140</BemyndigedeCpr>
        <BemyndigedeCvr>20921897</BemyndigedeCvr>
        <System>FMK</System>
        <SystemLangtNavn>Fælles Medicinkort</SystemLangtNavn>
        <Arbejdsfunktion>Læge</Arbejdsfunktion>
        <Status>Oprettet</Status>
        <RettighedNavnBeskrivelse>
            <RettighedNavn>SundhedsfagligOpslag</RettighedNavn>
            <RettighedBeskrivelse>Sundhedsfagligt opslag</RettighedBeskrivelse>
        </RettighedNavnBeskrivelse>
        <Oprettelsesdato>2016-01-04T10:10:00Z</Oprettelsesdato>
        <Gyldig_fra>2016-02-01T00:00:00Z</Gyldig_fra>
        <Gyldig_til>2017-01-31T00:00:00Z</Gyldig_til>
    </Bemyndigelse>
    <Bemyndigelse>
        <BemyndigelseKode>DB83CA88-2B84-4ADE-908F-596F9ABE366C</BemyndigelseKode>
        <BemyndigendeCpr>2005511871</BemyndigendeCpr>
        <BemyndigedeCpr>0304838140</BemyndigedeCpr>
        <System>DDV</System>
        <SystemLangtNavn>Vaccinationsregistret</SystemLangtNavn>
        <Arbejdsfunktion>Læge</Arbejdsfunktion>
        <Status>Oprettet</Status>
        <RettighedNavnBeskrivelse>
            <RettighedNavn>VaccinationVedligehold</RettighedNavn>
            <RettighedBeskrivelse>Opret, ret eller slet vaccinationer</RettighedBeskrivelse>
        </RettighedNavnBeskrivelse>
        <RettighedNavnBeskrivelse>
            <RettighedNavn>VaccinationVedligeholdAnbefalet</RettighedNavn>
            <RettighedBeskrivelse>Opret, ret eller slet anbefalede vaccinationer</RettighedBeskrivelse>
        </RettighedNavnBeskrivelse>
        <Oprettelsesdato>2016-01-04T10:10:00Z</Oprettelsesdato>
        <Gyldig_fra>2016-01-04T10:10:00Z</Gyldig_fra>
        <Gyldig_til>2017-01-31T00:00:00Z</Gyldig_til>
    </Bemyndigelse>
    <Bemyndigelse>
        <BemyndigelseKode>2079412A-FC09-4072-A5DA-039B80357369</BemyndigelseKode>
        <BemyndigendeCpr>2005511871</BemyndigendeCpr>
        <BemyndigedeCpr>0304838140</BemyndigedeCpr>
        <System>TAS</System>
        <SystemLangtNavn>Tilskudsansøgningsservicen</SystemLangtNavn>
        <Arbejdsfunktion>Læge</Arbejdsfunktion>
        <Status>Oprettet</Status>
        <RettighedNavnBeskrivelse>
            <RettighedNavn>*</RettighedNavn>
            <RettighedBeskrivelse>Alle nuværende og fremtidige delegerbare rettigheder</RettighedBeskrivelse>
        </RettighedNavnBeskrivelse>
        <Oprettelsesdato>2016-01-04T10:10:00Z</Oprettelsesdato>
        <Gyldig_fra>2016-01-04T10:10:00Z</Gyldig_fra>
        <Gyldig_til>2017-01-04T10:10:00Z</Gyldig_til>
    </Bemyndigelse>
</bms20160101:HentBemyndigelserResponse>