<?xml version="1.0" encoding="UTF-8"?>
<bms20160101:IndlaesMetadataRequest
        xmlns:bms20160101="http://nsi.dk/bemyndigelse/2016/01/01/"
        xmlns:xsi="http://www.w3.org/2001/XMLSchema-instance"
        xsi:schemaLocation="http://nsi.dk/bemyndigelse/2016/01/01 ../../../main/resources/schema/2016_01_01/bemyndigelsesservice.xsd">
    <System>TAS</System>
    <SystemLangtNavn>Tilskudsansøgningsservicen</SystemLangtNavn>
    <Arbejdsfunktioner>
        <Arbejdsfunktion>
            <Domaene>SST</Domaene>
            <System>TAS</System>
            <ArbejdsfunktionNavn>Læge</ArbejdsfunktionNavn>
            <ArbejdsfunktionBeskrivelse>Autoriseret læge</ArbejdsfunktionBeskrivelse>
        </Arbejdsfunktion>
        <Arbejdsfunktion>
            <Domaene>SST</Domaene>
            <System>TAS</System>
            <ArbejdsfunktionNavn>Tandlæge</ArbejdsfunktionNavn>
            <ArbejdsfunktionBeskrivelse>Autoriseret tandlæge</ArbejdsfunktionBeskrivelse>
        </Arbejdsfunktion>
    </Arbejdsfunktioner>
    <Rettigheder>
        <Rettighed>
            <Domaene>SST</Domaene>
            <System>TAS</System>
            <RettighedNavn>LæsAnsøgninger</RettighedNavn>
            <RettighedBeskrivelse>Vise indsendte tilskudsansøgninger</RettighedBeskrivelse>
        </Rettighed>
        <Rettighed>
            <Domaene>SST</Domaene>
            <System>TAS</System>
            <RettighedNavn>SkrivAnsøgninger</RettighedNavn>
            <RettighedBeskrivelse>Oprette tilskudsansøgninger og svare på yderligere oplysninger</RettighedBeskrivelse>
        </Rettighed>
    </Rettigheder>
    <DelegerbareRettigheder>
        <DelegerbarRettighed>
            <Domaene>SST</Domaene>
            <System>TAS</System>
            <Arbejdsfunktion>Læge</Arbejdsfunktion>
            <RettighedNavn>LæsAnsøgninger</RettighedNavn>
        </DelegerbarRettighed>
        <DelegerbarRettighed>
            <Domaene>SST</Domaene>
            <System>TAS</System>
            <Arbejdsfunktion>Tandlæge</Arbejdsfunktion>
            <RettighedNavn>LæsAnsøgninger</RettighedNavn>
        </DelegerbarRettighed>
    </DelegerbareRettigheder>
</bms20160101:IndlaesMetadataRequest>